{
  "generated_by": "scripts/refresh_rules_registry.py",
  "rules": [
    {
      "analyzer": "js_ts_security_preview",
      "languages": [
        "js",
        "ts"
      ],
      "rule_id": "EXC_EMPTY_CATCH_JS_001",
      "semantic_hash": "0508ddf7df859091de1f3538363d2b233c7d7993ebfdceee0a580eab2b68a9c2",
      "semantic_inputs": [
        "src/code_audit/data/treesitter/queries/js_ts_security.scm",
        "src/code_audit/analyzers/js_ts_security.py"
      ],
      "title": "Empty catch block"
    },
    {
      "analyzer": "js_ts_security_preview",
      "languages": [
        "js",
        "ts"
      ],
      "rule_id": "GST_GLOBAL_THIS_MUTATION_001",
      "semantic_hash": "5f5cbee64c675834477b26938f8c3c69d4ab803cd8da270ae05202eb2ffa78d5",
      "semantic_inputs": [
        "src/code_audit/data/treesitter/queries/js_ts_security.scm",
        "src/code_audit/analyzers/js_ts_security.py"
      ],
      "title": "Mutation of globalThis/window properties"
    },
    {
      "analyzer": "js_ts_security_preview",
      "languages": [
        "js",
        "ts"
      ],
      "rule_id": "SEC_DYNAMIC_MODULE_LOAD_JS_001",
      "semantic_hash": "a9dbdb51f2fb4e22737b2bcfc25194746a72f0f919ad0eb1882b81eecf7556e3",
      "semantic_inputs": [
        "src/code_audit/data/treesitter/queries/js_ts_security.scm",
        "src/code_audit/analyzers/js_ts_security.py"
      ],
      "title": "Dynamic module load via require/import non-literal"
    },
    {
      "analyzer": "js_ts_security_preview",
      "languages": [
        "js",
        "ts"
      ],
      "rule_id": "SEC_EVAL_JS_001",
      "semantic_hash": "69d731ff57e692fb203f9a5f215d1c4a5e9bef6f7aacd107744e37b4c9a37bd1",
      "semantic_inputs": [
        "src/code_audit/data/treesitter/queries/js_ts_security.scm",
        "src/code_audit/analyzers/js_ts_security.py"
      ],
      "title": "Use of eval(...)"
    },
    {
      "analyzer": "js_ts_security_preview",
      "languages": [
        "js",
        "ts"
      ],
      "rule_id": "SEC_NEW_FUNCTION_JS_001",
      "semantic_hash": "08ee0c43c4600535a77ec0e6628a073cea995c8eeca5fd3832da958d3dfb93bf",
      "semantic_inputs": [
        "src/code_audit/data/treesitter/queries/js_ts_security.scm",
        "src/code_audit/analyzers/js_ts_security.py"
      ],
      "title": "Use of new Function(...)"
    }
  ],
  "schema_version": 1,
  "signal_logic_version": "signals_v5"
}
